,classification,text
287,0,"Most career opportunities start off with a brief phone call to see if you're the right fit. I've done so many of those, that I always wondered if I was doing something wrong in my spheal. I never would get a call back. A week later, they would express their feelings that they decided to peruse other candidates at this current time. In fact, I've been so used to rejection that I went in the mindset that I would be rejected anyways. Eventually it became why even apply. 

I graduated last year and will make roughly two years I've been out of college. It's been a long, tedious process. I've been heartbroken, laptop gave way, wasted money, had to refuse extra hours at work to accommodate phone interviews, and then suffer by paying rent, but then eating ramen, and not to mention all the nights of forgoing celebrating with friends and family, in lieu of busting out one more job application, thinking hopefully this is the one, the lucky one that might grant me a call back.. 

I cannot tell you how much I'm in awe that someone could make the choice to see the potential in me. It's mellowing and mind blowing to say the least. The job search has been grueling and gruesome, to say the least.

I've thought of giving up, way too many times, way more then I can count, and this one means the world to me. Even if this isn't the career opportunity I have spent all this time looking for, just having the opportunity to view and see in person an actual company, an actual recruiter, I'm so touched and proud.

Wish me luck. I didn't know where else to post this, because I didn't want to jinx it, knock on wood, but this is it. 

If I don't get this, I just might work up the retail ladder. This is my last shot...."
288,0,"I put on a pair of pants that I hadn't worn since New Years. When I put my phone in my pocket I could feel something else in there, so I pulled it out and found a cheeky $50 note in my pocket! I had a flashback and remember being drunk putting that $50 in my pocket and thinking 'sober me is going to be so happy next time he wears these pants'... I certainly was! "
289,0,"I was in my living room at around 11 PM, and I heard a rustling and clattering on the back porch. I peeked out the window and saw a raccoon playing with some cat toys we'd left out. So I went up to the sliding glass door and laid on my stomach, just looking out until the raccoon noticed me. He came up to the window, and looked at me. Our noses were like two inches apart (with the glass between us, of course) and he put his little paw up against the glass like he was saying hello. I'd never been so close to a completely wild animal before. It was kind of exciting, and he was really cute. We just looked at each other for a bit before he wandered off.

I thought this was neat, but I know it's not exactly the most *exciting* story. Still, I really wanted to share it with someone, so I hope you guys don't mind hearing about it :)"
290,0,"I'm 17, got up for work this morning and found my dad dead. Paramedics said he had a heart attack sometime last night. It's been a long long morning and really just need to talk about random stuff right now to distract myself. Hope this isn't too dark for this sub and if it is I'm sorry. Hope you guys day is going better than mine, spend more time with your parents guys."
291,0,"I've been seeing this girl for two weeks, and last night I went to her house for the first time and met her family and she drove me around her small town and told me about its history. She held my hand for the first time while we were driving. And then before I left to go home, we hugged for a while. I told her ""You're something else, kid."" She stepped back and kissed me. And then she kissed me again. And then we both just looked at each other, and this crazy thing happened. We both at the same time leaned in and kissed again and it was the most passionate experience I had ever had, even though it only lasted for a second or two.

I've been really depressed for the past two years and she has seriously brought joy back into my life, and I think I've done the same for her. Thanks for letting me share this with you guys!

How is everyone else?! :)"
292,0,"Browsing /r/all the past few days, I've noticed that there are a lot more positive posts than there used to be, and many of the highest rated are from subs like /r/Eyebleach. /r/Wholesomemes seems to be the flagship for this movement, growing in subscribers rapidly and hitting /r/all like a storm.

Yesterday /r/Crazyideas created a new sub, /r/CongratsLikeImFive. It started with silly kids stuff like ""I ate my vegetables"", but today it's filling up with more genuine and mature posts like ""I dumped my abusive gf"" and ""I became financially independent"". These posts are getting a lot of genuine responses. I think a lot of people really want real praise, and others really want to give praise. (Edit: this is a trending sub and already has over 4500 subscribers.) 

I think this positivity movement is great. I think everyone needed a breather after the trainwreck that was 2016, and especially after the bad feelings that the US election season brought. These positive posts are super cheesy, but I've found myself thinking more positively in real life.

What do you guys think of the influx of positive posts? What do you think is causing it? Will it last far into the next year?

Edit: many of you bring up a good point: the /r/all filtering feature and the new voting algorithm seem to have brought down the frequency of posts from the most controversial/highly political/negative Nancy subs."
293,0,The Cracker Barrel meme comparing the price of their entire menu to the iPhone 10 is greatest single act of guerrilla marketing I have ever witnessed.
294,0,I am so so happy 
295,0,"1 year ago, I installed 2 Chrome extensions, the XKCD translator, and another one that delayed an extensions activation, I delayed the translations for 10 months. 2 months ago every single tumblr post I saw said ""spaaaaace"" instead of space, I just dismissed it as a tumblr meme or something. Then I saw in the news, that the Republicans had won the eating contests, I just thought it was a metaphor or something. I also play lots of Pokemon, and randomly, in bulbapedia, Electric type changed to Atomic. I thought it was just how it was called in Japan, and when translated to English, it was actually atomic. Also, I watch lots of movies, and I'm interested in superheroes and saw ""a man dressed like a bat"" instead of batman everywhere, specially reddit, and just thought it was a reddit meme. Not until like 10 minutes ago, while browsing amazon for Christmas presents for my nephews, I saw ""LEGO a man dressed like a bat 3"" I noticed. Saw the XKCD thing in the corner.

Tl;dr I trolled myself"
296,0,"Like seriously, I'm 25 now and it feels like everyone is all over the place. Some of my friends are getting married, some are having kids, meanwhile others are still figuring things out (myself included), some are still partying it up every weekend, and others are still in school. Life is weird after college.

Does everybody else feel the same way?

---

Edit: I had no idea how big this would blow up. Now I'm no expert in life, and what works for me doesn't work for everybody but I would like to hand out some tips that helped me through the first half of my 20s. 

1. **Focus on your foundations:** Friends & family, health & wellness, finances, and so on. Having a solid foundation is key to dealing with all the stresses. Having a solid social life works wonders when you have supporting friends and family who really want to see you succeed. Go for a run or walk a few times a week, even if you don't like exercise you will feel amazing afterwards. Start now with putting money into your savings, I recommend starting with at least 10% of you income. Once you have enough in your savings all your financial stresses will disappear.

2. **Explore new things! (aka get out of your comfort zone)** After graduation move to a place you've never lived before, try new hobbies, join different meetup groups, read more, this list goes on. Just get out there and try something new!

3. **Take on more responsibility.** Nothing feels better than knowing you can do something on your own: adopt a pet, move into your own place, aim for a promotion at work, or volunteer outside of work. 

4. **Find something bigger than yourself and contribute towards it.** One of the most common things I've noticed in this thread is people looking for their passions or looking for meaning in their lives. Luckily for you finding meaning isn't that hard, even if it isn't your fulltime job. You can donate to charity every paycheck, volunteer at a local nonprofit, start a fun side project (especially collaborative ones like a podcast or band).

5. **Do fun shit!** Go to music fests, go backpacking, take trips, go out on the weekends. Definitely take advantage of your young energy. I'm doing this by trying to see all the bands that I love live, and traveling a lot more, before life gets in the way. 

Focusing on these things has helped me get through my 20's and build myself into a better person in the process. What works for me might not work for you, but I just thought I'd offer my two-cents. "
297,0,It was actually pretty funny and makes me want to send one to someone.  
298,0,"So I am basically living hand to mouth. I just about clear my bills each month, I eat like a fucking fifteenth century peasant, and if it wasn't for my job I wouldn't have a car. 

I am the fucking happiest man alive right now. I am content with my life and adore the people I surround myself with. I am also within touching distance of a career I have always wanted.  Life is pretty good right now. 

Just thought I would have a brag. 


Edit:  For those who are asking, the career is law enforcement.  In particular, community policing. I want to help vulnerable people.  Where I live organised crime is pretty big, especially in rural areas.  Families and especially kids, fall victim to loan sharks and drug dealers. I want to help stop that.  The selection process is stupidly long. I have the final interview next week.  Shitting myself. 

 Also RIP inbox. "
299,0,"So yeah, we have those emergency sirens that would go off in case of a war or something like that.  
Every year in February those sirens are tested on their functionality by letting them run for a couple of minutes.

It's really creepy and I love it every single year. It sounds exactly as the Silent Hill siren (from the movies). 

Sadly today is really nice weather. When there's a big mist or something it's so damn cool!

Do other countries have those kind of sirens too? Do you test them as well?"
300,0,"It's my birthday today an my wife bought me a pair of [Enchroma Glasses](http://enchroma.com/) as my gift. I never bought a pair because I test as a [strong protan](http://wearecolorblind.com/article/a-quick-introduction-to-color-blindness/) and there is only a 30% chance that these glasses would work for me at all. So far, there hasn't been any real change to the 'reds' that I see, but for the first time ever, a green traffic light looked green to me. Normally they look white. And highway signs...holy cow, they are **green**

I'm pretty excited at what I have seen so far today. I'm hoping that as my eyes get used to the glasses (wearing them gives me a bit of a headache and strong protans can take a few weeks to get acclimated to the glasses) even more colors emerge.

This has been a really exciting day"
301,0,"So in gamer years I am pretty old *(45)*, not saying I am old in life, just old for an active gamer. I run a Street Fighter, specifically Chun Li, channel on YouTube and I've been posting for years now.

At the beginning I didn't really have a purpose other than just archiving what I thought were my cool matches. Eventually I started have a pretty big collection of content but still no one was really watching and I don't particularly blame them... It was a random dude playing a game at a pretty mediocre level.

The latest version of the game came out a little more than two years ago and I have been posting matches as I leveled up. In all it's nerdy glory, I have reached Diamond rank in SFV. Not an incredible feat for thousands of players but at the same time, it means I am in the top 2% of players in the world. And my matches kinda chronicle that journey.

The higher the rank has netted more views and on top of that I have been discovering tech within the game and sharing when I could. Lastly I have captured games beating some of the best people in the world.

So here I am, I am probably playing Street Fighter the best I ever have in my life *(after 30 years of playing)* and my channel has the most viewers it ever has. And as small as that is to probably so many streamers and channels... I am kinda proud of it.

*EDIT:* **WOW!!!**

Crazy way to wake up with so many responses in my inbox! I think I got back to everyone! Sorry if I missed a post and thank you so much for the words of encouragement and congratulations!"
302,0,"And now I have a fiance, and baby boy on the way, an apartment I'm proud of, and my happiness back.  

         After my grandmother passed away I was left her house.  I was born and raised in that house and my grandmother raised me while my mother worked non stop to provide for Grandma, my twin sister and I.    My mother found her husband when I was 13 or so.  But o continued to live with Grandma.  He wasn't the best person with kids.  Just didn't like them.
Anyway, grandma passes away when I'm 20.  
3 weeks after her death, I come home to all my belongings on the curb.  My aunt had power of attorney and taken possession of the house.  Immediately gutting it and selling all the appliances.   I was destroyed.  I couldn't believe my whole life was taken from me like that.  I still haven't talked to my family since. My best friend let me stay with him for a bit. But I couldn't take the heart ache of being in my hometown, having to see my gutted home.   I found a job 3 hours away and took it.  Apartment Maintenance.  Perfect I thought.  I've always been the handy man being the only male in the house hold.  
And life took off from there.  Succeeded in my job.  Connected with a old fling and ended up falling head over heels for this girl.  She now has a ring on her finger and a baby in the womb.  I can proudly say that I am at my best right now and I needed to tell someone about it.  
I love my life.  
I love you Grandma RIP 
You'd be so proud of me.
"
303,0,"I know /r/montageparodies had a hitmarker, that was awesome, any other sub?"
304,0,"""Omg a girl looked at me."" ""A girl said I'm cute."" ""How do i ask a girl out"". We get it already I think the proper subs are even listed when you have stuff to talk about like that. Just in case you didn't know.
/r/advice /r/teenagers /r/relationship_advice 

Please start posting in the right sub."
305,0,"I'm so excited! My wife just got her first (then second, then third - can't be too sure) pregnancy test a little over a week ago. We've been married a little over three years, in our late 20's, and this will be our first child. We're not making the social media announcement until after our first appointment next week, but it's such a hard secret to keep!! Any advice for first time parents?"
306,0,"A doctor gets a call at 4 AM. 

""Me and my friend,"" the caller says in a rush, ""we went hunting. My friend climbed up a tree to search for deer but fell down. I think he's dead. I'm panicking here, I don't know what to do..""

""Calm down,"" the doctor replies. ""Just take a deep breath and do everything exactly as I say. Can you do that?""

The caller takes a deep breath and lets it out slowly. ""Yes,"" he says.

""Ok,"" the doctor says, ""first why don't you go check on your friend and make sure he's really dead.""

The doctor hears a loud shot.

""I've made sure. What next?""

"
307,0,"After months of working and going through a lot of trouble (because we live in Puerto Rico and since hurricane Maria, the light isnt stable)
We had some trouble with Spotify at first because they put our song under other artist name, but finally they created our own profile and im really happy!
Just wanted to say that

Edit: Since people asked for it but I cant put a link, just look for: Until Further Notice by Webo (we are also on apple music)

Edit 2: If someone wants the link just DM me or let me know and ill send it to you!"
308,0,"So, for the last 20 minutes I've been fighting a computer virus that throws anything I click on into the recycle bin and then tries to immediately delete it. I was really confused as to how I got it, considering I hadn't been downloading anything recently and I have really good virus protection. I wiped my hard drive and started over since I have most everything backed up on Google Drive. It kept happening.

Turns out my delete key was stuck."
309,0,"http://i.imgur.com/njD9mdC.jpg

Okay so I was at Disneyland yesterday for my grad night. I'm in the line at one of the food places and I just see jaden Smith standing there, guarded by like 4 Disneyland employees. And so I just go up to him and ask him if he's jaden Smith and he goes ""Yea, and take this paper. It's a tweet I've never tweeted out yet and it's just for you"" and then just fucking walks away. I'm still in shock that I experienced this. 

EDIT: Proof that he was AT FUCKING DISNEYLAND yesterday https://instagram.com/p/2o8vgpHdOT/

EDIT 2: Oh my god I made it to the front page of reddit I love every single one of you"
310,0,"I posted here in January about taking myself on a date for my birthday because I had nothing else to do. I was just flicking through my diary entry from that day and I wrote about how sweet you all were, and how it warmed my heart how kind strangers could be.  
  
I just wanted to say thank you again to everyone who took the time to say something. Who would have guessed that so many internet strangers could have brightened up my birthday just with an anonymous message? It reminds you that there are lovely people all over the world at the touch of a button. Isn't that amazing?  
  
Let's get a conversation going and share the love! Do you have a story about a stranger (IRL or online) being kind to you? What about a story of you being the kind stranger?"
311,0,"Rejecting a reflection is test of one's grit

Seeing through a mirror as a window

Though mercurial it may seem to frolic

I find peace in that meadow.


I was told to post here from r/seriousconversation

A broken mind is not so strange anymore, so much moves and changes and yet you feel as if you stay still, never changing, never growing. Suddenly I changed, im excited but also afraid. Not of everything else but of myself. I am prone to change internally, i fear that i fear myself. I scoff at suicide and yet i don't feel its farfetched that i might go that way. I am able to reason that one's reflection may indeed be fake. Cogito ergo sum. Afterall there is no reason why death should not be like before birth, against this logic i still find myself terrified of the end that will not likely be for many years and yet i fear may happen immediately. My greatest weakness is my misunderstanding, i crave closeness so when i am offered reprieve i go to far or i find for once im not being my average characature Max and instead cheater, liar, sociopathic Max. I am scared writing this as my thoughts quicken and i am brought hope by a few things. 1. My dream of being loved by someone completely isnt remote, there are so many people in this world. 2. I will likely live for a long time. 3. I have read that one's attitude changes each decade, i hope this is true.

Edit: for people who feel they may be in a similar place to me i implore you to read the comments as they are very insightful"
312,0,"The Mrs. travels a lot for work. I was doing laundry and unpacking her suitcase. At the bottom of the suitcase I found, rolled up, her sexiest piece of lingerie: a black lacy see-thru that is my absolute favorite thing to see her in. What the hell is she doing taking it with her on a business trip? She's having an affair with some coworker?!? And somehow wearing this particular piece of lingerie makes it even worse. What the hell? Married 17 years, three kids - all of our lives are about to go to shit.

Oh, wait - it's just a black 2-layer blouse with a lace outer layer.

Hmm, wonder what's on TV tonight."
313,0,With the info dropped by /u/yishan recently.. it seems appropriate. 
314,0,Now I'm gonna design some new ones 
315,0,"Today's my 22nd birthday, and at 2pm I got an email from futureme.org. At first I thought it was spam, but I decided to read it... And it's definitely from me!! It had me grinning all day long. Here's the whole mail:

Dear FutureMe, 
well anyways, this is me... hope you had or still are having that relationship with [guy I had a major crush on for numerous years]. My cel phone hasn't come yet (stupid mail) and mybest friend is Bethi. HMMMM and I'm gonna see Harry Potter 5 at the weekend. Remember Maggie, and all your other friends you left back in Texas. Lose some weight ;-). It's been raining for days and I hate it, how am I supposed to get a tan (well i already got one) if the sun doesn't shine. K550I 4EVA. uumm...oh right! You're 13, single, and you hate you're life, don't forget it. I like to listen to Avril Lavigne, Wir sind Helden, Billy Talent, Fall Out Boy, 30 Seconds to Mars, Rihanna, Alex Gaudino, Linkin Park, Shakira, Beyonce, The Veronicas, Lemon Tree =D, and sum others. Well umm, you'll be 22 by now so ROCK ON. Luvya babye!!! Dont forget, 
[about 20 past classmates I couldn't care less about]
AND [GUY I USED TO HAVE A MAJOR CRUSH ON]!!! 
Take Care, [my nickname]!

PS. By now you should have: been bungee jumping, met avril lavigne+ autograph, been scuba diving, been strapped to akite in a thunderstorm =).... ETC

THE END

"
316,0,So I'm studying abroad for the past 2 years. I went away around the same time she was born so ive only been able to see her during Christmas and a small duration of the summer. Ive been here for almost 2 weeks now and its the first time she tells me she loves me and im probably the happiest person alive atm and nothing can change that
317,0,"It is typical for when a student makes an A for them to say something like, 

""I made an A!""

But, when a someone fails, it is not uncommon to hear, 

""The TEACHER failed me."" 

Some people argue that it's the student's fault (Which I agree----to an extent----a teacher can only do so much).

BUT, this is how I like to see it...

When you succeed, I succeed too. 

When you fail, I fail too. "
318,0,"You meet a girl who seems like just another gal. It feels good to be around her and she makes you laugh. Shortly after that you realize you'd rather spend time with her than with anyone else you know. You have a few fights, but you make up each time. You start to understand her better, and you start to understand yourself better. 

One day you realize that you love her. And when you tell her, she's so happy. You just told her you love her. It's not a favor. It's not something you chose. It just happened. And yet, when you tell her she's so happy, and you're so happy. 

Then one day, you realize that this is it. That this person you just met one day and who was just a cool gal a few years ago but is now the most important person in your life. And you can't live without her. And everything you thought you knew about life is different now. So you ask her the question both of you are waiting for, ""Will you marry me?""

I got engaged. And I'm so happy."
319,0,"Because the fucking bot wanted me to add con""text""."
320,0,"I’m legitimately feeling so dumb right now. I thought calling POTUS and FLOTUS were come kind of insults towards the president and his wife or a play on the title for the pope (pontiff). Clearly it is not nor do I have any idea where my thinking came from outside of lack of knowledge. 

Anyway I was googling Barbara Bush and that led to Abigail Adams somehow and I was on her wiki page. Before I knew it I clicked on First Lady Of The United States and saw FLOTUS in parenthesis. Then it all clicked. It’s not an insult or anything negative. It is literally just an abbreviation for President of the United States and First Lady........

I had no idea and I’m really glad I don’t ever indulge in politics of any kind with anyone. 

**my bad on the spelling error in the title and also come should have been some in the second sentence. :/ time for bed. "
