,classification,text
74,0,"Major lurker on reddit for the last few years but this seems worth posting about


So i was laying in bed with the wife at about midnight. She was fast asleep and i was almost there when i heard my doorbell ring. I get out of bed and go down the hall to the front and ask who's there.  Some girl says her name is Allie. So i crack the door open to see what the deal was. Long story short she and her BF tell me their truck is stuck in a ditch down the road and asked if i could help them pull it out (with my truck that was parked in the driveway). Okay... I've been there so i agree and tell them to give me a minute to get dressed.


They seemed a little sketchy so i was wary from the get-go. But hey i'm sure i look a little sketchy to some people too, and the town i live in has a high poverty level and i was way below it for many years myself, so i tried not to judge to hard and just help.


Anyways we get in my truck and everything seems chill. We're talking about how they have a 2 year old and i have 3 kids myself.  I get close to where they told me their truck was and i see a couple cop cars stopped at it checking it out with their lights on. The first thing these people say is ""oh fuck, keep going!"" 


I was a dumb kid once and had my share of run-ins with the law over doing stupid dumb kid stuff. I ask them what they got in the truck. The guy says they have a pit bull in the truck. Okay... I don't buy that for a second because there is nothing illegal about that in this town. It wasn't worth the way they were acting.


So I drive past their truck and immediately one of the cop cars start following and i'm telling these kids that we are gonna get pulled over and they beg me to tell the cops that's not their truck. I tell them I'm going to tell the cops exactly what happened of course because I don't know you people, sorry bout your luck.


Sure enough the lights come on for us to pull over so i stop my truck right there and kill it. This is where stuff gets a little crazy. Worth mentioning at this point I notice the guy shoving something under my seat. I assumed it was drugs.


I roll down my windows as the officer is getting out of his car and i hear the very distinct sound of a round being chambered in a weapon. The officer puts on his authoritative voice and tells everyone to show their hands. He then orders the driver (me) to get out of the truck and keep facing away from him with my hands in the air and slowly walk backwards till he says to stop. When he stops me he tells me to get on my knees. He asks me who's in the vehicle and what's going on.


I tell him straight up these kids knocked on my door, said they were stuck, then freaked when they saw the cops. He's very reasonable and professional. Tells me he's going to detain me until he gets this figured out. So he handcuffs me and sets me in the back of the squad car. I'm not freaking out or anything myself because i live a block away and it can be verified easily that I was just being a good samaritan.  


He then goes and gets the guy out of my truck, handcuffs him and puts him in the back of the car with me while he goes and gets the girl.  I turn and look at the guy and say ""what the fuck man? I'm just trying to help someone out and ya'll got me handcuffed in the back of a cop's car with a rifle drawn on me.""  

The kid was very apologetic to me and says he swears he don't know whats going on. I tell him no big deal, shit goes south sometimes and I know I'm in the clear. 


After the officer talks to the girl he cuffs her and puts her in the backseat after getting me out. He tells me they verified what i said and tells me that the truck that was stuck is stolen out of Kansas! He then asks me if i own a revolver and asks that if he goes and looks in my truck and finds a pistol that it definitely wouldn't be mine. I tell him no sir i only own rifles and they are locked up at home. He asks for permission to check in my truck and i give it to him. 


I kid you not he went right to where the guy was sitting looks under the seat and comes back with that pistol he asked about within 15 seconds. So not only did they ask for help with a stolen vehicle, this dude had a freaking fully loaded .38 special in his pocket too. 


The cop kids around with me a bit and says 'no good deed goes unpunished, huh?'. I give him my information and phone number in case he needs an official statement from me. He thanks me for cooperating and sends me home. That was all the information i got about those two though I'm sure they are going to the county jail for awhile.


I get home, open a beer and tell the wife about the exciting last thirty minutes of my life. She reacts accordingly and tells me I'm not allowed to help strangers in the middle of the night again. I finally get back to sleep for about two hours and now i'm sitting here typing this up in a sleep deprived and adrenaline fueled daze.

I know this got long and thanks to anyone that made it this far. I just thought the lovely people here would like to hear this and I'd love to hear your thoughts on the matter.



TL;DR
    Got woke up in the middle of the night. Thought i would help someone get their truck unstuck the way i have been helped before. Ended up getting an AR pointed at me, handcuffed and put in the back of a cop car for awhile. 
 
Edit* The response to this post has been amazing. The comments from both sides of the discussion on being a good samaritan have been truly thought provoking and you all have given me a lot to think about. You guys are awesome thanks for all your input. 

Also I'm trying very hard to reply to as many people as I can but in between kids soccer games and my own family and friends wanting every detail I'm falling behind. So if I miss someone I promise I have at least read every comment on here. "
75,0,"Pretty cool, I had a serious problem for quite sometime. Its been a rough 90 days but it doesn't compare to all the rough days that alcohol addiction gave me. A new life has ben born!

EDIT: Woke up to tons of supportive comments and a thank you to the someone gave me gold! You all rock!"
76,0,"So, it's morning here.  I'm sitting in the bathroom like normal, and lo and behold, this tiny little gray field mouse comes skittering across the floor toward me.  (Eek!)  He just stops in the middle of the floor and kinda looks at me and then heads back out into my apartment.

I get done in the bathroom and I go out into the living room, and there he is... Just sitting on the little patch of tile I have inside my front door.  I go over and I open the door for him and he heads back outside.  I guess he's off to do whatever mice like to do early on Saturday morning.  Maybe get a bagel and a latte?  I have no idea.

Anyway, I thought it was an interesting way to start the day."
77,0,"This has been a long time coming but I am finally gonna muster all the courage I can and ask out my crush on a date. Also putting this down makes me feel obligated so I don't chicken out

Edit: after 2 years, 8 rejections and lots of anxiety, I have a date with a pretty girl. I'm on top of the world right now guys. 

Edit 2: thanks for all your kind words. If you're afraid of saying how you feel to someone, remember it only has to work once. We will fall many times on the road to success but those who never give up reach their destination.

Edit 3: Gold? Aww you shouldn't have. Thanks whoever you are! I'll pay it forward."
78,0,"As a returning adult student, I was so nervous. I remember posting my hesitance last year on reddit and someone said ""Sorry mate it probably won't work out for you"" since I discussed my previous attempts at school.

Well it did work out, 2 semesters under my belt now, and a 4.0 this semester. Pretty excited moving forward, it's been a very validating experience so far.

It's never too late to go back, I am now 36 and my classmates are varied in age, some are 18 or 19, some are in their 50s or 60s. It doesn't matter. Go back if you want. 

**Edit:**

A few things:

I have a hard time concentrating. I suggest [the Pomodoro technique](https://en.wikipedia.org/wiki/Pomodoro_Technique) for time management. I refuse to take ritalin or anything else along those lines, it's not for me. I just deal with it.

I don't take notes unless I have to, I used [mind mapping](https://en.wikipedia.org/wiki/Mind_map) because reading notes sucks and stuff gets smeared, scratched out, lost, can't read my writing, etc. <- I HIGHLY SUGGEST YOU DO THIS. Practice it first and develop your own method of doing it. It makes studying faster and prettier. 

This is probably irrelevant but I am a lady not a sir. "
79,0,"Last time somebody made me dinner out of nowhere was like 4 years ago and it was my ex-gf who loved cooking. 

It feels so nice to come back to apartment and see dinner ready. I'm gonna devour that chicken with rice with a joy I didn't think was possible."
80,0,"I just wanted to brag a little bit. I'd smoked cigarettes since I was 15 years old and quit here and there every once in a while but it never stuck. This is the first time I've gone so long without cigarettes. I'm 23 years old.

So, yay to me! :)

Edit:

Okay, so wow! Thanks everyone! I've been trying to respond to all the comments. But really thank you guys!

A lot of people are asking. I basically decided one day I was just going to quit. I had somewhat of an epiphany one night laying in bed and really, truly thinking about what I was doing to myself and my body. What was I going to look like in 20 years if I kept smoking? How would my voice sound? Would I have cancer? Would I even be alive?! Yeah, it really hit me! I also lost a ton of excess weight and quit biting my nails within the last two or so years, so checking the ""quit smoking"" box off of my bad habits list really hit the nail on the head for creating a healthy lifestyle for myself. I DO use an ecigarette, but I've only been using 3mg nicotine for the last 6 or so months and will eventually drop the habit all together.

If you're struggling, think of it the way I did. You are hurting yourself! Find a new hobby or a good habit to replace the bad ones in your life. Distract yourself with positive things. Have a good support system and surround yourself with good vibes and healthy relationships. I'm just one person out of probably millions who have quit smoking.

You can do it! Drop your cigarette! Do it now!






Edited words so I can English."
81,0,"Has anyone else got any stats which they think would be cool to know, but it's impossible/impractical to actually gather the data?"
82,0,"To start, this isn't a pitch for anything--i didn't subscribe to a program or find some miracle drug.  i have some amazing friends and i was so lucky with how everything fell into place with me that i'm still a little bewildered.

The tl;dr is that i was a pretty hefty drunk for the last ten years.  lost a friend (hey--as an fyi i'm coping very well with this, i've grieved and feel very much at peace with this, it's not an open wound any longer), and realized that i'd made a life of nothingness and boredom for myself.  so i quit booze, and decided to fix myself a little bit.  really jumped into a super busy social schedule (pursuing new hobbies with my old friends, why not?), and BAM, here comes this cool chick who coulda walked out of a movie and straight into my life.  i'm still fixing myself, and working toward things i want for myself, but she's a little motivation to prioritize fixing myself so we can continue to have what we have.

i'm happy.  so crazy."
83,0,"Hello. Last night, my thesis supervisor informed me I got the mark I had hoped for, which means I will graduate 'cum laude' (highest attainable honors in the Netherlands) for my Master's.

My girlfriend was of course very excited. But right now I'm in China and it doesn't seem very appropriate to share my excitement with the people here, many of whom I hardly know.

I was just very happy so I wanted to share it with you instead. Do you guys have any cool college/university stories that you could share?"
84,0,"So I took off my headset and said thank you and took a bite of one. Then I realized she didn't offer me a donut at all, and I just randomly stole one of her donuts. Is there any recovery from this or do I just stop showing up to work now?

edit: I should probably finish the story.

Turned out she just stopped by to talk to her friend. She then talked to her friend that she came over to see while I quietly ate my donut next to them for the next 10 minutes. I did not enjoy that donut"
85,0,"I’m 25 and I finally got a full time job.  I moved to a new city with my dog and really started this life on no money.  I’ve been running on $100 my mom gave me for 3 weeks. My credit cards had about $700 on them and I owe my dad $500.

This morning I saw an email I finally got paid, even though I started my job 2 weeks ago. Some people told me I wouldn’t get paid for 4 weeks. 

I just saw the deposit and I felt this huge burden come off my shoulders.  I paid off my credit cards immediately.

I’m still feeling a little survival-mode because it’s only my first paycheck and I’m scared I’ll run out before my next one... but damn.   "
86,0,"Some common things to appreciate not having: stuffy nose, runny nose, stomach ache, head ache, cold sore, tooth ache, hang nail, pimple, paper cut, sunburn, sprained ankle/wrist/etc., pulled muscle, and neck/back pain.

All of these things when you have them you wonder what it feels like not having them so think about for a moment what it feel like. I'm sure there's more! Let's discuss!"
87,0,"I wonder what the room thinks of this? It's still kind of condescending, but it's not a direct argument that will end up in a back and forth about how ugly the subject is. "
88,0,"Was getting something out of the fridge when my hand knocked a glass jar, almost full of this Thai sauce I had just bought. The glass exploded everywhere when it hit the ground.

Then I remembered the tip I read a couple of weeks before that said to use your phone's flashlight and shine it across the floor. So I did and it worked perfectly. Even the smallest pieces of glass I wouldn't have seen otherwise gave off a big shadow so I could find them.

It was still an arduous process, but it was nice knowing I got every single piece instead of missing any"
89,0,"I accidentally interviewed for an audio and light technician job when going in for a marketing job interview. I didn’t find out until the end of the interview that I was interviewing for the audio and light technician job. Despite this, I still got the job somehow.


I start training in 2 weeks and I’m super hyped."
90,0,"Every time I show my mom something from reddit she refers to reddit as a whole as ""my friends on the internet""

So thanks everyone on reddit for giving me funny and cute things to send to my mommy to make her smile, and yes you are all my friends :)"
91,0,"Im chinese first off and i see nothing wrong with that girl wearing a traditional/modern chinese dress. She looked hella fine. Plus its not like shes doing it injustice. Shes not going to strip clubs or doing something that shames our dress. Man this world is filled with pussies.  Yall need to chill.

As long as your not wearing it for like halloween or doing something stupid with it, im fine with it and alot of my family members agreed thats its no big deal"
92,0,"I lose my shit when I'm trying to post something. I end up putting way too much effort into the title, the post and everything else because I am afraid that people might downvote me and disagree. Ok, putting it this way sounds stupid but I think you guys get what I mean?

What a time to be alive. I'm scared because of the darn internet "
93,0,"It is kind of a sad realization; most of your friends would either be busy with work on weekdays, and with their girlfriend or wife on weekends, and you don't get to hang out with them that much. It makes you feel alone and lonely. 
Anyone else felt something like this?

EDIT: Slept on it last night, and was amazed to see all the responses. Would be a bit mean to say, but am glad that I am not the only one who feels this is true. 
Some key takeaways that I got from the comments below-

1. Majority of the people feel lonely in this age range (give or take 5), but they tend to do something about it or else loneliness really gets to their mind

2. Almost everyone suggested to get a 'hobby'. Now I have heard this A LOT, but I really did not know where or how to start (until now). One of the comments that I found helpful in this regard was ""get three kind of hobbies - one which is for yourself and only serves as your outlet (sketching, gym, etc.), one which helps you meets people, and one which gives some sort of secondary income (however small)"". Now again, there might be some personal bias to the way I see it, but I just thought it would be nice to mention it.

3. For people who do not want to get a hobby (social interaction can be overwhelming at times), they usually try to stay inside and play video games. This came out as a common theme

4. Some also suggested volunteering, as it is peaceful, and you get to meet new people

5. Based on the comments below, can confirm that this happens with girls as well

6. A significant percentage of people are enjoying their time alone in their late 20s/early 30s. A common theme here is that ""they get time to do things they want""

Some comments said that they are still in their late teens, and this post terrifies them. I am really sorry, but I did not intend to do that. You never know, life might turn out interesting for you as you age :)
Will keep on updating the list as I find more gems of wisdom! Thank you everyone for sharing :)"
94,0,"Within a month of my wife and I dating, I bought myself my first brand new car. It was a 2004 Subaru Forester, and I loved that thing. It had a unique body style, in that there was no frame over the windows (like [this](http://static.howstuffworks.com/gif/vehicle-pictures/2003/subaru/forester/1177-037-driver-side-door-open-480.jpg)). After I was done taking my now-wife for her first ride in it, she got out of the car, grabbed the top part of the glass, and shoved the door closed by the glass.

I was in shock- I wanted to tell her not to slam the door by the glass, but since we had just started dating, I didn't want to seem like a neurotic prick about my car. I had to think of a plan...

So the next day we went somewhere else. When we arrived at our destination, I stopped her from getting out. ""No, no"" I said. ""Let me get the door for you."" Boy, was she impressed. And I got the door for her the next time, and the next, and every other time for going on 12 years.

She has no idea that this display of chivalry was borne out of me not wanting her to fuck up the window of my brand new car."
95,0,"I was telling my coworker what YouTube Red was,  I don't subscribe to it,  but she (60s F) heard someone mention it and she always asks me about tech and pop culture stuff.  I explained it was a paid service that allows you to watch content sans advertisements and that it has exclusive content as well as other perks. 

She told me she might check it out. 

This morning she came to me and asked if I was messing with her,  because ""That red tube thing is an adult website""

After laughing my ass off,  I found out she typed redtube.com so it didn't even search,  it just went straight there. I showed her YTR on my computer and she was mortified. 

This isn't the first time (although it's the best) something like this has happened with an older coworker of mine and technology. Share your stories"
96,0,"Edit: Guys/gals, I'm gonna have to call it quits at this point in terms of updating this thread with news. Its 3am here in Britain and I'm developing a minor headache so need to go to sleep xD I don't know if mods can take over this thread and update it instead, if they want to/can do that I invite them to do so. The best place to get information on this right now is the [summary on /r/OutOfTheLoop](https://www.reddit.com/r/OutOfTheLoop/comments/3bxduw/why_was_riama_along_with_a_number_of_other_large/) and the [live coverage going on right now](https://np.reddit.com/live/v6d0vi6c8veb). Goodnight everyone!

--------------------------------------------------------------------

So, as of right now, starting with /r/IAmA, multiple default subreddits including /r/science and /r/movies have gone private. The widely publicised reason is that the person who handled all IAmA's on multiple subreddits, Victoria, was fired by Reddit with no warning whatsoever to the mods.

I've decided to post here because I kinda don't know where else to discuss this :S What on earth is going on? I'm afraid this has a very serious possibility of causing Reddit as we know it to collapse in on itself and we'll all have to emigrate to another website :(

Edit: Welp, this thread just turned into a megathread. I suddenly feel somewhat exposed. o_o Since I feel like I have some responsibility to make this look at least somewhat presentable...

EDIT: I'm afraid I'm getting rather overwhelmed here guys/gals. I'll keep updating the default subreddit list, but please expect the non-default list to not be up-to-date. Subreddits are shutting down left right and centre!

**Current list of default subreddits that have turned private includes:**

/r/IAmA 

/r/science 

/r/movies 

/r/gaming

/r/Askreddit

/r/Art

/r/history 

/r/listentothis has restricted submissions, although it hasn't shut down completely.

/r/videos

/r/gadgets 

/r/Music 

/r/books 

**Current list of non-default subreddits that have turned private includes:**

/r/circlejerk

/r/CrappyDesign 

/r/law

/r/spain 

/r/eatcheapandhealthy

/r/4chan

/r/fallout

Please let me know if you've noticed other subreddits that have gone dark and I'll add them to the list!

/r/OutOfTheLoop has a great summary megathread if you're confused about what the hell is going on, which [can be found here](https://www.reddit.com/r/OutOfTheLoop/comments/3bxduw/why_was_riama_along_with_a_number_of_other_large/), and live coverage of The Darkening/AMAgeddon/Victoria's Secret/The Reddpocalypse [can be found here!](https://np.reddit.com/live/v6d0vi6c8veb)
"
97,0,I've never had a complete stranger ask me for one before. I was extremely honored and flattered that he enjoyed my drumming so much that he wanted one of my drumsticks (the dude even said he was gonna put it in his man cave!) I've played to 500 people before but playing this show to only around 20 people was so much more enjoyable because everyone there was super friendly and into the music. Definitely the best show we've ever played!!
98,0,"My dad was the most caring and giving man I know. He would literally give the shirt off his back for anyone. We had over 750 people come to his calling hours and collected hundreds of jars of peanut butter for homeless people in our area, with more jars still coming to us. It's such a great thing to see when it seems like all the main headlines in news today are tragedies. Just thought I'd share this story with you guys!

Edit: Wow, thanks for all the support everyone! In response to some people asking where to send further donations, you can send them to:

The Mohawk Valley Community Action Agency
9882 River Road
Utica, NY 13502

Thanks so much to everyone who wishes to donate more peanut butter. This is taking off much more than I ever hoped it would. Know a lot of people will benefit greatly from your generosity! "
99,0,"I have been hosting some Russian clients and their families for the past few days, we do full day boat trips in South  a Florida and usually provide lavish platters with snacks, cold meats and fruit, I freaked out for a second there thinking the platters where incomplete but after further observation I realised that they where all, from grandmother's to toddlers digging into the fruit platters like there was no tomorrow! 
I made a friendly comment along the lines of ""gee you guys really love my fruit platters"" but then one of the adults explained to me that in Russia, fruit is outrageously expensive and basically inaccessible to the general population, so when they come to the USA they really love eating fruit, 

The next few days I made MASSIVE platters with mangos and lychees and papaya and all sorts of amazing fruit in great quantities, they showed so much gratitude for that gesture it made me very happy to make them so happy,
I just can't imagine being somewhere where you can't afford fruit! 

And it brings me to my next point, what are things that maybe the general population take for granted but are difficult to get in other places? 
"
100,0,"So I've just been out of a 6 year long relationship which didn't end the best way. I thought for the longest time I wouldn't be able to move on, but it's been about 3 weeks since it happened and yesterday I asked out a girl. It ended up not ending so well because she knew my ex-girlfriend and didn't want to complicate things - BUT, I actually managed to gather myself and ask someone who I found attractive out! 

I feel great, even though I don't have a date. Maybe soon!

How are the rest of you folks faring? "
