,classification,text
147,0,"2 weeks ago I went to LA and we parked our car and crushed a 6 pack on the beach in Venice and saw all the craziness go down there, then got in an uber and told the guy to take us to somewhere with a bunch of women. The driver, an Italian guy in his 40's, starts recounting how much ass he used to pull (his words) in West Hollywood and how we should go to West Hollywood and don't worry that it's going to be mostly gay people, they don't bite, and that so many women go out there. We decided to go for it and he advised us to go to the Abby.

We went and I immediately noticed the go-go dancers, a bunch of lean, muscular, thong clad men dancing on platforms. I've been to numerous bars with scantily clad female go-go dancers and never thought anything of it, but I bet that for some women that can be terribly intimidating or indicating of an objectifying environment, was an interesting thought. My buddy and I grabbed drinks and surveyed the scene, there were indeed some women and A LOT of well groomed, well dressed, guys walking around, if I hadn't known it was a gay bar I would have thought ""wow there's a lot of competition here."" I also noticed a lot of people returning my gaze looking around.

Then my friend went to the bathroom, leaving me alone. It was like a feeding frenzy. Guys were COMPETING for the opportunity to buy me a drink, hitting me with pick up lines, walking up like ""I love you."", having conversations that went like this ""hi"" ""hi"" ""where you from?"" ""san diego"" ""oh take my number, if you need a place to crash just hit me up."" it was NUTS.

I tried to talk all suitors out of buying me a drink because I knew what they were after and they wouldn't be happy with the result as I was straight and came there to meet women, that deterred 0%. I finally asked one of these guys why he wanted to buy me a drink and he said ""because I can"" so I said ""OK"" so he asked me what I was drinking and I said anything, he said no what are you drinking so I said whiskey soda, he said what kind of whiskey and I said ""well"" to which he said ""please"" and ordered Makers Mark. 

So then I'm talking to these guys and other guys keep coming up trying to talk to me and the guys I was talking to got all snoody like ""Don't talk to those losers."" One such guy would not go away or stop being too forward, and not in a fun way, so I instinctively told him that my friend, who had come back and was also down to jump on the free drinks train for a while, was my husband (which I have had multiple girls do to me with people who were obviously just friends of theirs at times when I've not taken a hint) so then this dude starts sheepishly grabbing at my ass when he perceived my friend as not looking. 

Wound up making it out in one piece and going to some after hours spot with these Russian girls we met there. (which is it's own crazy story, I cannot believe LA has legit establishments that you can smoke weed and do cocaine openly INSIDE at). Due to the novelty it was a good, funny experience, but I totally get why women go to gay bars now. I could see having a hoard of thirsty dudes trying to bang you as fast as they possibly can getting old pretty fast.

**Edit: Regrettably a good amount of the comments on this post are a fiery-worded debate about the morality of straight people going to gay bars. I even got sucked into it there for a bit. I'd like to remind everyone that this is /r/casualconversation. I'd like to acknowledge the point of view of these gay people, I was unaware that some (and it sounds like many) gay people do not appreciate straight people coming to gay bars. I lived in a small town in the Pacific NW for a year that I could definitely see 2 guys making out or dancing at a bar leading to an otherwise unprovoked physical altercation, this was in a very blue state, I'm sure there are places like this in almost all states. I understand the overwhelmingly strong desire to have places where you can let loose like any person wants to and feel safe doing so.**

**I may strongly dislike being told it is morally wrong of me to go to a place due to my sexuality (this is actually my first experience with that) but I have no interest in debating my righteousness in going to a gay bar, if it wasn't clear from my post, this is not my routine and there is no threat of this becoming my routine. I learned something today and it sounds like a lot of other redditors who are getting fired up were unaware of this too. Let's play nice. It was a funny night out and stuff that happened to me happens to women at bars all the time, that's all I meant by the post.**"
148,0,"And unsurprisingly, each year the stories that give me comfort are becoming rarer."
149,0,"Anyone else?  Esp now in the fall when its still dark outside.  I get up, feed the cat, light a fire in the fireplace, make a Latte and whip out the Reddit.  After she eats, the cat will usually curl up next to me. 

It is my favorite time of the day.  

After the kids get up its a whirlwind of getting them ready, getting me ready, and everyone out the door, so now I'm waking up extra early just to get that time. 

Anyone else savour this time of the day??

eta: Good morning! here i am again, reading responses in the early morn!  I loved this one in particular:

https://www.reddit.com/r/CasualConversation/comments/7aalln/that_one_hour_in_the_morning_with_your_coffee_and/dp8n7yp/

""Makes me feel like I own the day. If I start out rushing to leave, the day owns me."""
150,0,"I also thought hiatus was a state of America. And I used to pronounce comfortable like comfort-table until I was 13. 
Yeah. 
What are some misconceptions about the English language you had, native speaker or not? 

Edit: since this post is getting quite a bit of attention I thought I'd list some more examples of my stupidity because I was a damn interesting kid. 

• You know that bit in Alejandro by Lady Gaga that goes ""hot like Mexico, rejoice""? I thought ""Mexico rejoice"" was a hot sauce that Lady Gaga was comparing this Alejandro guy to, because he was just so hot. 
• I mentioned this in the comments too, but I used to pronounce British like ""Braytish"". 
• I thought fetish was another word for admiration. I may or may not have used that word in that context. 
• I thought plethora was some sort of plant.

Edit 2: My most upvoted post is one where I talk openly about being stupid and make my country sound like Voldemort's safe haven. Wow. 

Edit 3: WHAT THE FUCK, I GOT GOLD????? Can I eat it? "
151,0,"I'm a trans woman, and I am finally being myself starting today. I've waited my whole life for this, and it's pretty nerve-racking, in a good way.

Edit: holy cow this blew up! =) Thank you for the kind words and encouragement, everyone. Thank you for gilding my post! And thank you for cleaning up the thread, mods!

Today is a ~~good~~ *great* day!

---
**Update**: My day was awesome! I've found peace after so many years...

Thank you all so much for the positivity. I'm humbled by how many of you are so wholesome and accepting. You move me to tears. I am not lying when I say I couldn't have done this without the strength and courage that everyone who supports me gave me, including all of you. Thank you."
152,0,"**TL;DR** was fatass, now a nominally healthy less-fatass. motivational circlejerk at the bottom

I was overweight/obese for as long as I can remember. I was teased as far back as 1st grade and I remember feeling ashamed of shopping in the husky section for clothes (which, now that I think about it, is a shitty name to subject fat kids to). I always tried fad diets but never lost more than 5lbs. per attempt.

Age 15, I was 215lbs, the highest I've been, and considered obese at my height. I had to train for 1 year for my black belt which involved a shitload of cardio. I had just gotten into reddit and found out about /r/keto and /r/ketorecipes. I was desperate so I tried it, and I wound up coming down to 165 in that year. That was still overweight but I was able to keep up with all the other trainees.

For the next 3 years I periodically tried more keto but couldn't find the motivation to stick with it now that I wasn't training for my black belt. So I stayed overweight. This semester, I dragged a friend, also looking to lose weight, into it with me and I guess that's all the motivation we needed. We've run a mile and biked 3-4, 3x a week for the past 2 months and stuck fast to the diet. Coincidentally, he's also lost 25lbs and feels amazing.

Today we went to the gym, I weighed myself, and I turned out to be 145, the exact weight where overweight stops and healthy starts according to BMI for my height. Like I said, I have no recollection of this ever happening in my life. This is a new, exciting thing for me. I still have some fat to burn off but just the  idea of being healthy for once is amazing.

The funniest thing about all this, for me, is that I'm short and have barely grown at all since my early teens. And I was already overweight back then. So I'm pretty sure I weigh less now than I did at age 12.

Sorry for the rant, I'm just excited. I never would have thought this would be possible, but here I am. Thanks for reading, if you have indeed read this all. If anybody is trying to lose weight, please remember that it's hard but definitely possible. And if anybody needs help, motivation, or advice with their own weight loss, please feel free to ask via comment or PM. Of course, there's /r/keto and /r/ketorecipes as well."
153,0,"There is this dad at my daughter’s school whom I’ve met several times.

The first time we met, we introduced ourselves and since then we've talked with each other several times.

The problem is that I never remembered his name, yet he remembered mine.

He always verbalized my name every time we met, but unfortunately I could not do the same so I got stuck with the generic “Man”.

Any time we met, I said: “What’s going on, Man? How are you? Good to see you.”

At one point it became awkward so I decided to ask his name, but I didn't want to say, “Sorry, I forgot your name” because that would have implied that I never knew it all along, so I decided to go with a different approach.

The next time I talked with him at my daughter’s school, midway through I looked at him and said:

“You know, my wife and I have been discussing about how to pronounce your name properly. We just don’t seem to agree and I don’t like to mispronounce anybody’s name. Can you pronounce it for me exactly as your mom pronounces your name?”

The guy looks at me with eyes wide open and says:

“Joe”

It's probably better to just say that you forgot."
154,0,"I have always been an outgoing person but over the years I noticed that I was being influenced by my surroundings and I was starting to become an antisocial homebody. Nowadays people find any possible excuse to stay inside and do nothing. I would even offer to pay for my friends/significant other and their things and yet everyone around me seem to be into the “couch potato lifestyle “, even my now fiancé. So today I took the courage and finally purchased a ticket for a concert I’ve been looking forward to go and I’m going all by myself and I feel great.

Don’t let the fear of doing an activity by yourself  stop you from doing those things and enjoying life :)

Edit: thank you for all your stories and feedback everyone, I also just sign up for moviepass so I can go to the movies multiple times a month by myself since my significant others is not a movie-goer"
155,0,"Few hours ago, in the United States, [gay marriage was legalized nationwide](http://www.cnn.com/2015/06/26/politics/supreme-court-same-sex-marriage-ruling/).

I've been having a string of bad days, but this is nice...

Actually smiled this morning. What about all of you?

***

>Edit: Being gilded for this; Reddit's servers are happier.

>**[President Barack Obama's full speech](https://www.youtube.com/watch?v=b715GKJNWXA).**

***

>**/u/turkeysock's, and /u/MorningredTimeTravel's upquote was [""Thanks, Obama""](http://i.imgur.com/o3egucL.png).**

>**/u/tizorres' upquote is also [totally on par](http://i.imgur.com/jwwZxxy.gif).**

>###Oh, wow — [I'm never taking off my rainbow flair](http://i.imgur.com/ojqAFJv.jpg)!


"
156,0,"Not sure if this is the right place for this so if not feel free to direct me to the right place. 

I'm happy because I have less stress in my life, but at the same time I miss these people I cut out to a certain degree. I mean some of them are part of my family so it wasn't an easy decision to make. It just sucks and I hope I made the right choice. 

Any one else ever go through something similar? "
157,0,"I always wanted to be a mom, my career was secondary so I never had a full-time job.  Now, my life is changing and I'm moderately petrified.  Give me advice, share your kick-assed stories of success and give me the confidence I need to get through these next two years!

Edit: I am overwhelmed with your stories and words of encouragement!  Do me a favour, call your moms - you're all obviously proud of what they did, so tell them as well.  If they were half as scared as I was then their hard work and dedication should be acknowledged! 

BTW, my first day wasn't all that bad!  I'll check back in 2 years and we can celebrate my graduation!"
158,0,"I've had depression for about ten years, self harmed for 5 years and am now finally 5 years self harm free! I can't believe it!! I've had points where every day felt like a struggle I'd never overcome and other months where I've not even thought about it! Sorry if this kind of post isn't allowed but I'm so proud of myself right now and just wanted to share!

Edit: Also am happy to answer questions, give advice etc. :) If you're having a tough day (I know Christmas is often shit for me because of this wonderfully un-festive anniversary) then make sure you talk to someone!

Edit 2: I've tried responding to as many of you as possible, thankyou so much for your love and support and for popping my gold cherry! A lot of people are asking how I did it: I set myself goals, so if I could manage a week, I'd aim for two weeks, because if I'd already done a week then I could do it again, right? And each year I focus on reaching the year so I can celebrate it. For my five years I treated myself to a [commemorative tattoo](https://imgur.com/UeXRUvX) which I've been focusing on since this time last year. "
159,0,I seem to be one of the rare people that does this. I just love when people interact with me on reddit and thus they deserve an upvote.
160,0,"**EDIT** - oh my. My inbox just exploded

__________________________________________________________

I am an atheist *(well I am not really sure yet but I am probably an agnostic atheist)* and I can fully understand the mentality behind religion

I am sort of in a love-hate relationship with religion

I can understand its purposes, mostly in terms of giving hope to people or at least it helps them to make sense of the world around them, especially to those who are unfortunate.

It may a false sense of hope and belief but it makes sense to them *(like example, a soldier prays to God, that slight sense of hope may affect his psychosomatic response in battle and may actually increase his chance of making it out alive)*

I will admit that I do not like it when religion takes over, namely the extremist kind like for example, fundamentalists, those who prefer prayer over modern medicine, those who wish to spread their beliefs by force, when religion is mixed with the legal system, when people judge others based on their beliefs and so on.

However .....

I am also **VERY, VERY** annoyed when atheists love to bully those who are religious, namely because of the increased interest in science and logical thought.

I am supporter of science and I fully acknowledge its purposes but I do not want to use my knowledge of science so far *(because even science goes through changes as times goes on)* to humiliate those who are ignorant *(as in, the uneducated)*

That is why I do not like the science icons that are on the media like Bill Nye, Neil Degrasse Tyson and Richard Dawkins.

I admire their intent to spread science and logical reasoning but I absolutely despise how they make religious people act like idiots *(and I mean religious people in general, not to those who are fundamentalists)*

*(and I mean especially Richard Dawkins. He is known as one of the four horsemen of Neo-Atheism for a reason)*"
161,0,"I just wanted to share some of the sillier and more wonderful things about my dog because I won't get many opportunities to discuss Frodo very often any more. 

He was a little Maltese-poodle (more poodle). He hated water. I don't think he ever entered water on purpose. However, he was attached (to a disturbing extent) to my mom. When she would kayak out onto the lake, Frodo would run whining out onto the dock to be that tiny bit closer. The only time he ever got close to entering the water by choice was then she brought her kayak closer and he decided that jumping from from the dock to her kayak was a great idea. That didn't work out. Frodo was not a dog built for water.

He did, however, love snow. My mom sewed him a lovely little snow suit, including pants and all. Looked a bit like a dog space suit. Anyhow, even if there was only a few centimeters of snow he would drop his from legs, put the side of his face against the ground, and run full speed with his back legs so his face would plough snow. He would also jump into excessively deep snow and immediately get disoriented and go in the wrong direction. Even when hiking in the hottest months in the North Cascades, he would without fail always find that little bit of snow leftover in the shade under a tree to do this face running thing. 

My favourite memory comes from when he was only a year in my family, and a family friend sent us a ""Duckworth."" Bloody brilliant toys, at least, if you asked Frodo they were. I've never seen him do this with any other toy: he took the duck in his mouth, laid on his back, legs splayed, and laid motionless for probably fifteen minutes straight growling at the duck wedged in his mouth.

He also laid on top of the couch back like a cat, could jump to any height if a hamburger was involved, did burnouts on the linoleum (while squealing quite loudly), and would stick his nose as far down the car air vent as possible when we were on road trips. 

What a wacky dog. Share your happy memories. Pets are so precious, and they build so many lovely feelings over the years. This is about the happy memories :) 

**Edit:** I have been informed that Frodo is now making heaven a magical and happy place with his weirdness. The last I saw of him was through facetime with his head nestled on my dad's lap, and when I said his name his ears perked up. I sadly couldn't be with him but as mentioned, this is about the happy memories. What a lovely little creature. Read on if you want some funny stories about pets, I'm not the only one here sharing some laughs. 

**Edit 2:** I'm very happy that this post in dedication to the happiness our little friends bring us has managed to break 100 upvotes. Love for everyone :) 

**Edit 3: [Here's a photo of my little friend while hiking in the subalpine of the North Cascades.](https://i.imgur.com/YfUqcZi.jpg)** My mother designed and sewed him that snow suit. The picture sums up his essence: a reborn Arctic explorer."
162,0,"When I was 15 years old, I met my first love. You remember your first love? All the nerves, the stomach butterflies, they are all you can think of morning, noon and night?
A few months ago we found each other on FB. We discovered that all these years later, and mulitiple moves, we only live a few hours apart.

Today, 45 years later, we are meeting again.

This is going to be so cool! I'm waiting for him now and I can't wait!

UPDATE:  It went so beautifully! Giving him a hug, we fit together perfectly,just like old times!  Just being with him was so perfect, so calming (he's always was very mellow). We went to dinner, we visited, he spent the night...but no, not together haha.  Today we went had breakfast, went for a drive.

To answer, yes we are both single. It was not a date, it was a meeting of old used-to-be lovers. We were each others ""first"".

Will we see each other again...yes, we are planning on it!  You never know!  As my daughter said: ""Wouldn't it be cool if your first love was to be your last love also?"""
163,0,"Apparently he lives in Denmark now. He did a complete 180 - really nice, seemed genuinely sorry for stuff he did back then. Also he's now a physics teacher, which is weird because I remember his physics being absolutely trash when we were classmates. But it's nice to see people sometimes change for the better."
164,0,"I've been applying heavily since before being let go at the beginning of December (they found out I was looking and fired me). I've been feeling really down about myself lately and not having much hope. I'd been on several interviews, but passed over for one reason or another. 

Well, today I got two phone calls for two different positions in my field. I couldn't be happier, and I just had to tell someone!"
165,0,"We were alll just sitting around talking since we didnt have any work to do, then one of the girls in my glass played a video of her friend singing. Everyone started saying that she should sing for us, and so she did. Holy titballs it was great. Her voice was powerful and had a distinctive crack to it. Not a bad voice crack like a preteen talking, but one that just adds a layer of emotion to the song. It definitely surprised everyone in there, and I think she could have a career in music"
166,0,"[Here it is](http://www.reddit.com/r/AskReddit/comments/2ixvsc/what_is_your_favorite_small_20k_subreddit_and_why/)


Welcome, anyone new :)

"
167,0,"A broken atm card, and some drinks lead to an upset lady. He overheard her phone conversation with me, handed her the cash and walked off without a name or a number. Strangers can care too some times. So thank you."
168,0,"I was afraid of going to some shop like a small cloth shop where i have to interact with people because i have social anxiety and color blindness. It was embarrassing for me to ask the shopkeeper to get me a light blue shirt while pointing at a pink one.
The social anxiety part was also there already. I was afraid of doing anything alone. But i decided to get rid of my social anxiety and this was the first step i took. I am pretty happy with myself right now. I am feeling relieved, and optimistic. Has anyone gone through similar situation?

Edit - here the pic for the clothes i bought, for those who are wondering. [pic](http://imgur.com/a/0q8hd)

I hope it looks good. I still don't know what color the pant is, i bought it coz i think it looks good. The shopkeeper said it's kinda green.
And btw thanks to everyone for such positive comments, you guys are awesome!"
169,0,"I find it living indoors, on a high\-rise apartment, with the air conditioner on looking out to the beautiful urban landscape with the sound of rain hitting the glass window extremely soothing. Do you agree? What are some of your favourite favourite things to do when its raining?"
170,0,"I'm posting this thread not only to see how everyone on /r/CasualConversation  did with their goals, but because...

Exactly a year ago today in the 2014-2015 /r/AskReddit New Year's Megathread, [I asked](https://www.reddit.com/r/AskReddit/comments/2qxd1t/2014_2015_new_years_megathread/cnaf0x0):

*What's one thing you want to achieve by 31st Dec 2015?*

*RemindMe! One year ""Message whoever answers this question and ask if they achieved it!""*

It's now 31st Dec (GMT), so it's time to keep up my part of the bargain! About 70 people answered my question so I will post each person's goal in the comments below.

I hope you were all able to achieve what you set out to achieve.

Edit: Thanks for the gold! [**HERE IS THE NEW 2016 THREAD!**](https://www.reddit.com/r/self/comments/3ywu0b/what_are_your_2016_new_years_resolutions_write/)

BTW it's not massively important but I am being addressed as 'bro', 'man' and 'sir', I'd just thought I'd mention that I'm actually a 'sis', 'woman' and 'lady' :D 

*Also: The Reddit publication 'Upvoted' interviewed me and wrote an article about the New Year's Resolutions threads. They didn't ask me to promote it or anything but I thought it was pretty cool, so if you want to have a read, [here it is](https://upvoted.com/2016/01/02/redditors-share-their-results-of-last-years-resolutions-and-offer-encouragement-for-2016/).*
"
171,0,"She said yes. We went downtown and had a blast. I told her that I liked her and she felt the same. We ended up kissing and planned a second date this Monday. This is my first relationship and I'm really excited. I kinda just want to talk about it and decided this was the right sub.

Edit: Well this blew up. Who knew that you could  get ~~800~~ 1700 karma for bragging about going on a date.

I think I might delete in 24 hours

Edit2: I'm not gonna delete the post."
172,0,"I know sometimes things can be really hard, and you don't want to talk to people because of that. But you're still Carrying on silently and that deserves massive respect <3. 
How did your day go? I'm here to give you internet comfort points and hugs along with *gibs free cookies* thank you for trying so hard you matter!

Now if there's anything I can do or rather *we* can do (all the lovely people in here) by listening to you vent I'd love to. 

Edit: If someone would like to check my little sub r/WholesomePals I'd be blessed thank you "
