,classification,text
0,0,"Due to the limitations of foster care, I cannot identify him, or post his name or picture on social media. So, I won't \- but man, do I want to. I want to shout it from the rooftops. He's breaking the cycle of poverty. He is more likely to have children that go to college. For now he wants to do mechanical engineering, and he's already into robotics and 3D printing. He's going to kill it.

Join me in celebrating tonight. Raise a glass to the rare, *rare* foster kid that makes it out OK. He's got 4 younger siblings that get to watch him set the pace. He's going to be their hero.

\*Edit\* Didn't mean for this to be self\-congratulatory if it comes across that way. My wife and I have been in this boy's life for only about 6 months. 100&#37; of the credit goes to him and him alone, I'm just happy to be here to support him.

\*Edit 2\* Reddit Gold? 2,000 up doots and climbing? I was always worried that my top post would be some silly cat video. Glad it was something nice about my kid instead. Yay internet, you rock.

\*Edit 3\* I've read every single reply up to this point, and tried to comment when I thought I could provide value. Thank you all so very much for the kind words. Both of my teens will be reading this post and your advice, congratulations, and other kind words will hit their mark. I am tired now and want to get back to an awesome weekend with the family \- we are attending a film shoot thanks to a different reddit post about my other foster kid from a few months ago! Please continue to spread good thoughts and if you can, help a foster kid get into school. Killer Mike is speaking about a different topic that affects young people, but he's spot on, [get them educated](https://www.youtube.com/watch?v=JhudugDROn0)."
1,0,"Probably the first time in years that all of America, if just for a few hours, didn't argue about politics and beliefs, and just looked up at the sky with wonder and awe. I think that's just beautiful and worth noting."
2,0,"I am not ""new"" to Reddit but, new to posting on here (just the last few months). I just want to do a damn snack exchange but need 600 Karma to post there!! I am not begging for karma here, I am legitimately asking HOW to do this??? I gift a lot of pizzas in random acts of pizza, I try to comment on threads I feel like I have something to add or say, but OMG it's been like 5 months and 17 gifted pizzas and still not to 600!!! Shit, I have even given 10 gold's to people! Please tell me the secret!!! I am desperately wanting to do a snack exchange :)"
3,0,"My gf and I were both living off our savings while looking for a rental, which opened us up to living in areas we might not have otherwise considered. We found a massive, beautiful, recently remodeled townhouse well within our budget and half a mile from the office I had just gotten hired at. 

We had both mostly lived in middle-class suburbs before. The week we moved in, there was a murder at the gas station located at the entrance of our neighborhood. This area was always ""the bad part of town"" in my mind and in the minds of my peers. When people asked where we lived, we named the interstate exit and never our street. 

The first week I lived there, I was considering putting bars on the lower level windows. I nearly jumped out of my skin one night when I heard footsteps in the woods behind the house. I was almost ready to run inside to grab a knife when a fat, trash eating possum waddled by. ""Phew! I thought you might be a crackhead,"" I'll never admit to thinking. 

After two years, I've come to realize that I don't live in a bad neighborhood. It's just a not-mostly-white and low-income neighborhood. I have neighbors of every color and we all wave at each other, talk, laugh, and get along. 

If I forget to take my trash out on trash day, my next door neighbor often does it for me. That shit never happened in the suburbs. There's a stray cat that has gained about 5 kitty pounds recently because me and both the houses next to me have been feeding the little shit. That's pretty cool and neighborly. 

Last Friday my gf and I were out back at 3am. We heard a rustling in the woods. Soon after a tall, shadowy figure of a black man appeared. No panic was felt. I have since learned that it could be a possum or it could be a homeless person. I've had many nights where a homeless person comes walking through the woods and we get to talking and hanging out. Sometimes I share my booze with them, sometimes I share some food, and on a couple occasions I give them a blanket and let them sleep on my lawn chair. So when a shadowy figure of a black man appeared at 3am, I didn't panic. Instead I called out, ""hey, Too Tall? That you?!"" It was him. 

So, the prejudice I have overcome isn't color based like you might have assumed. It was class based. I no longer immediately equate low income with dangerous and ignorant. 

This might be a little heavy for this sub, but I can't think of a better place to talk about this without it turning into a shit show. So, please, share your thoughts. I just renewed my lease another two years. "
4,0,"Hello, my name is Jack. I'm sorry I haven't updated in 2 months. I am a 50 year old man who was never able to conceive with my wife. We really wanted to adopt but were unable to due to financial issues until recently. 



As you may know [we adopted a 15 year old boy named Jonathan.](https://www.reddit.com/r/CasualConversation/comments/74x3rq/i_adopted_a_teenage_boy/) He has been dealing with depression, anxiety, anger issues, PTSD, and an eating disorder. 


So what's changed since two months ago when we had recently adopted him? 


For starters, Jonathan was kicked out of yet another school quickly for fighting (the school he had been in before we adopted him but only for like a couple months) so we decided to put Jonathan in a special school for troubled youth. 


Although it's a very slow process and he still skips class and gets in fights this school is definitely doing some good. They focus on how to fit into the world, mental health, anger management, all stuff relevant to Jonathan's life.


Jonathan still smokes. I found text messages on his phone between him and another boy about a drug transaction. The drug in question was oxycodone. I asked him (in a pub casually so that he felt relaxed and not pressured) why he wanted this drug; opiates, while providing pain relief, can be very addictive and dangerous.


 He basically told me that his pain and trauma are bigger than anything pot and cigarettes could help with. I told him its a very bad idea to buy opiates off the street and if he is looking for help all he needs to do is ask and we will try to help best we can. So, I scheduled an appointment with the doctor. He agreed not to go through with the transaction so I told him I was proud of him and I swear he smiled a little bit.


As you may of remembered, Jonathan since meeting him has been extremely aggressive. I was prepared to take this on since the moment I met him as I am much taller and bigger than him. I was, however, a bit afraid for my wife. Well, Jonathan has thrown things at me and attempted to hit me and such many, many times since I met him but he has never tried to hurt my wife at all and for that I see he is a good boy and he can live a normal, happy life eventually if he can get passed all the trauma in his life.


Well I signed him up for boxing early on and gave him a punching bag and that helped at the beginning, although he was still very aggressive. Lot's of these issues that come with adopted children take nothing but time and care and support to resolve and two months later Jonathan, while still aggressive, is getting better every day. 



In the two months since I originally posted, he has stopped freaking out every day. He still gets mad everyday but not freak out-throw things-scream mad, just mad. The freakouts i'd say come about once a week now which is a huge improvement.



We still go to the pub once a week which he has always really enjoyed. I think one of the things with Jonathan is he likes to be treated as an equal. 


Jonathan speaks more than he used to. This is a great achievement because in my orignal post he just got angry or was silent but in these past two months he has started to speak more. Sometimes just random things like 'have you read this article in the newspaper'. 


It's a slow process but it's really awesome seeing Jonathan progress further and further as time goes on. I believe he can get through this all and move towards a bright future.



Edit: I forgot to mention the eating. Yeah, it is still as much of a challenge to get Jonathan to eat as it was 2 months ago when I made the original post unfortunately. "
5,0,"Yes, her rendition of the National Anthem was... not great. But I feel like the people of the internet forget celebrities are people, too, and they're being really harsh.


There was a Reddit confession from am anonymous A-lister a few months ago where the gal talked about reading through the malicious comments about her on social media and getting more and more depressed. The post was eventually locked because people kept trying to guess who she was. (Many people seem to think it was Kim Kardashian.)


That post really hit me, because she was venting that she was so depressed because of this internet bullying that the only reason she hadn't committed suicide was because of her family and kids.


So, not knowing where else to post this, I just wanted to say that while Fergie may not have done a great job singing the anthem, she's still a human being with real emotions. People need to take a chillaxative and quit being so harsh over something so relatively inconsequential.

Just because someone is famous, or just because you've never met them, doesn't make it any less serious or hateful to bash on them. It's still bullying.

I guess I'm just venting because people *reeaally* like to jump on the bashing bandwagon and I'm sick of it. That is all.


 **Edit:** Hello, all. This definitely got more of a response than I was expecting, and while I'd love to respond to everyone, I have some things to do, so in a mass response to everyone:

- Thank you to all the lovely people who took part in this post, whether for or against this opinion. I'm happy this started a good discussion.

- I understand that it's Fergie's job to sing and whatnot, but someone doing a bad job at something almost never justifies treating them like garbage. (Unless someone started a nuclear war or killed an entire family or something; by all means, rip away at 'em.) As with everything in life, there is definitely a gray area, and you are more than welcome to have a differing opinion - I just don't want to be a person that adds any more heartache to the world than necessary. There is already enough of that.

- Obligatory ""Thanks for the gold, kind stranger!""

Okay, that's all I've got for now. Have a nice day, everybody.


**Edit 2:** Okay, I know I have stuff to do, but lots of people are commenting stuff along the lines of, ""Well, she gets paid a lot of money, so it doesn't really matter.""

Well, here's my reply I made to one of those commenters:

>Well, I can agree that her life is definitely financially easier than the majority of our lives. 

>However, there's a reason the phrase ""money can't buy happiness"" exists.

>Money solves the physical problems - better healthcare, better food, better clothes, better cars, and so on.

>Still, while the ""landscape"" is different, the base problems are still the same - fear of death, humiliation, depression, jealousy, frustration, et cetera.

>That's what makes us human - those feelings, those fears, those desires.

>All I'm saying is, let's not forget that people like her are people, too. The entertainment industry, while financially lucrative, is extremely emotionally taxing.

"
6,0,"I've known this girl for a couple years now and we've always been really close. We met in residence in our first year of university and now in our third I live right across the street from her, so we see each other everyday. I've never been closer/more open with anyone else, but I never imagined her in a romantic context (even though everyone who knows us has told me we should date). Well, I did, but wouldn't admit it to myself.

Anyway, she recently broke up with her long-term boyfriend and since then we've been spending even more time together. I sorta took notice but didn't do or say anything different because I didn't imagine she thought of me that way and also she just got out of a break-up, so obviously she just wants company. 

But last night coming home from bar trivia she comes over as she normally does to have another drink and listen to music. We're both half-falling asleep and half-cuddling when she puts on this song that I absolutely love. Something just clicked in my head then and I lean in to kiss her.

Turns out we've both been crushing on each other for years. We stayed up all night laughing at ourselves in between kisses. It's fantastic feeling, being with a girl you already know you love. I've been smiling all day and I just had to tell someone. 

Thanks for hearing me out, reddit. Sending good vibes your way. 


**Edit** Thank you all for the well wishes and support. I'm glad that you can enjoy this as much as I am (well, probably not as much as me, but in the neighborhood). You guys are the best. 

**Edit 2** Gold! Thank you very much, stranger. Super happy that this story brightened people's days and got them to reminisce. It makes a great feeling even better. "
7,0,"My mind is blown 
Edit: okay well apparently everyone else got it wrong too so

Ftfy "
8,0,"I'm 16, male. My friend and I were at the mall together and she held out her hand and said, ""Could you hold this?""  Confused, I took her hand, and BOOM, we were holding hands.  I was so surprised and so happy at the same time! I like her a lot.  :)

Then I realized that I was holding her hand backwards, so I switched hands. Oops. I've never had been in a relationship or anything, so this is just so new and exciting for me.  :)

E:  Awww, my first gold ever! Thank you so much <3"
9,0,"Last week I was sharing a hostel room with only one other person. He turned off the light to go to sleep, climbed into bed, and then started asking me questions about my life. We talked about our lives, our countries, his divorce, my future, politics, being a woman vs a man traveling, etc. None of it ever crossed the line or made me feel uncomfortable. 

We talked for hours, and I never even saw his face, since there was furniture between us and the lights were off. I think that helped us both be completely honest in our answers and emotions. It was just one of those experiences that will stick with me for a long time. "
10,0,"This is a bit embarrassing, but last winter in my city it was really, really cold. I was young and paying rent and not making a lot, but I'd just been given my tips for the week so I was downtown trying to get Christmas presents. I saw a homeless teenager lying on the sidewalk, and feeling the tips heavy in my pocket I pulled out a $20 bill and handed it to him. He stared at me and said ""really?"" And I laughed and told him to buy a blanket and kept walking. 
When I left I realized how dumb I was, because I knew it was likely he'd buy drugs or alcohol. However a small part of me thought there was a chance that he'd put it to good use. 
Anyways, the next week I saw the same guy with a brand new fluffy blanket over him. 
I didn't tell my family this or anyone else really because I feel so odd about handing someone $20 like that, especially since they know I'm tight on money myself! But I thought I'd share it here, maybe it'll brighten someone's day :)

Edit: thank you for the gold!! Now I need to figure out what to do with it :)

I'm not really understanding the hate. Even if I was a ""karma whore"", which I'm not, isn't this at least a break from all the sexual assault news and everything else that's happening? It was something that happened that I haven't told anyone, so I thought I'd post it here! :)

Also apparently I've been featured on r/humblebrag or whatever it's called. If it came across this way, I'm sorry. Like I said, I just wanted to share something positive! "
11,0,"I'm still puzzled, I don't know why she did that. "
12,0,"OK, I must warn you that this is a long and strange story. Sit down, bust out the popcorn, and prepare to be underwhelmed. 

A year or so ago, I was sitting around watching youtube. I didn't have adblock at the time, so I was watching an ad for the Seat Toca (a car). There was a song in the background of this ad, and I *loved it*. The ad was only about 30 seconds long, but the song was bloody amazing. I was immediately determined to find this song. 

I started watching the ad on repeat, trying to figure out the lyrics so I could google the song and find it (my usual strategy). But nothing turned up. 

People in the comments section were discussing the song; several other people were trying to find it. Someone said it sounded like a guy called Mike something (I can't remember the full name of the artist). So I searched for Mike something, and went through a lot of his discography. But still - no luck. I tried searching his name + the lyrics, but... nothing. 

I tried using shazam. For those who aren't familiar, this is an app that uses the microphone on your phone to identify songs. The idea is that you play the song, turn on the app, and the app will tell you the name and artist of the song. But shazam was bloody hopeless, and couldn't identify the song. I downloaded the app, just for this one song, and deleted it when it failed me. 

At this point, I must admit that I was watching the 30-second ad once or twice a day, just so I could listen to the song, no matter how briefly. 

My next step was to *email the Seat marketing department*. I'm deadly serious, I actually did this. I sent a polite email, asking what the song was called. A few days later, I got a reply. The Seat employee told me that the song was a special commission for this particular ad, and wasn't available for general release. Essentially, it's not a real song, and there's no way to find it. 

I was heartbroken, but also felt a certain sense of closure. I popped back into the youtube comment section, and let everyone know about my findings. I had been keeping my IRL friends updated throughout this entire saga. They found it hilarious, and mocked me for the effort I was expending in order to find this song. I'm the kind of guy who can be very determined - if I want something, I'll put a lot of effort into getting it. This was just another weird project of mine, which unfortunately didn't work out. 

But so it goes. I moved on. I almost forgot about the song.

Fast forward to today, about one year after I originally heard the song. I get a random PM on Reddit. It's from a user I've never spoken to; a user who frequents subreddits that I'm not subscribed to. I have no idea who this person is. 

The PM simply said: 

>Song - Turn the lights down Artist - BSO

This song is on spotify, but not youtube or anywhere else. I made a spotify account, just to hear this song - if a random stranger PMs you a song, you have a duty to listen to it, right?

Well, I think you can all guess where this is going. Yes. Yes. IT'S THE BLOODY SONG! IT'S THE ACTUAL, LEGIT, FULL VERSION OF THE SONG!

I have no idea who that redditor is. I have no idea how they found me, and I have no idea how they knew about that song. I'm fairly sure I never mentioned it on Reddit. I send them a slightly crazed reply; a mix of utter gratitude and utter confusion. My reply read as follows:

>Oh my god. Oh my fucking god. I'm actually freaking out.

>Who are you? How did you know? WHAT IS GOING ON?

>Thank you so much. But also, WHAT THE HELL IS GOING ON

Their response was 

> Shh bby is ok

I shit you not. Never before have I felt such love for a total stranger. 

So, yeah. Wow. This is a pretty huge deal for me. 

For context, [here's the ad that started it all](https://www.youtube.com/watch?v=hxkWhTrSPVI). The song is called ""turn the lights down"", by an artist called BSO. The full song isn't actually as great as I had hoped, *but that's not the point!*

Edit - I've just realised that this whole post might be construed as a pathetic attempt at viral marketing for Seat. So I want to state that Seat are a terrible company, their cars are awful, and they are capitalist pigdogs that do not deserve your money. 

Edit2 - [here](http://imgur.com/RX7aea0) is a screenshot of the PM.

Edit3 - last one, I promise. [here](https://i.imgur.com/GAJvnao.png) is the email from Seat. [Here](http://imgur.com/TXs2aNE) is the full unredacted PM conversation (I didn't want to post this until I knew /u/TheVikingHoward was comfortable with it). We're starting to get an idea of what might have happened, but I'm not gonna tell you here because it ruins the story. This is not a marketing campaign, I am not a member of BSO, and I did not fake the whole thing using alt accounts. Shh. "
13,0,"I am a 50 year old man. My wife and I were never able to conceive. I wanted to help out a kid in foster care and give them a warm, loving home they otherwise wouldn't be able to get. Unfortunately, adoption takes time and money and we were not able to for some time as our financial state was poor until the last 5 years. 


When we started the adoption process we decided to adopt a teenager instead as they are usually neglected because adults seem to generally want babies/little kids. 


The boy we adopted's name is Jonathan. He is 15. He had been through some tough shit; abuse, neglect, being bounced from foster to home and back again. He was suffering with depression, anger issues, PTSD, and an eating disorder. 


I'll skip the boring process and tell you about what life has been like since we brought him home.


It has not been an easy task. Jonathan smokes alot (which we didn't know). When school started, we got notified that Jonathan was skipping class. We confronted him about it and he just seems to ignore us or tell us its his life so he doesn't care. At first when we adopted him he was cautious because he didn't know how we'd react to things - he thought he might get beat. Now that he knows that won't happen he's gotten more comfortable which is good but he has also gotten more teenage-ish and snipey. 


Jonathan gets into fights. He was sent home the other day for getting into scrap with another student. When we confronted him about it, he told us we weren't his parents and we should stop acting like it. We sent him to his room and basically grounded him. He got angry in his room and started punching the wall. I tried to be as calm as I could and asked him why he was angry. He screamed at me to f-off and tried to throw something at me but I dodged it. I continued to be calm. I told him if he apologized for yelling at me and attempting to hit me with something we could go to the pub and talk through this. After a minute he apologized and off to the pub we went.



He had calmed down a bit by the time we got there and served so I was ready to talk to him. He thought it was pretty cool that I didn't get angry or retaliate. I told him things are different in this house. I told him violence doesn't accomplish anything. After a drink we began to talk. I tried to talk to him about the matter at hand; why he was angry. I got a bit out of him. I won't give out all the details for privacy sake but I did get some useful information from his perspective that helps me understand a bit of what he is going through.


Since then, it's gotten a bit better. Once a week we got to the pub and he tells me some things. We are trying to provide as much support and love and care as we can. The other day he got mad and said we weren't his parents. I said ""but we are the ones who care for you"". He is a bit secretive which is why the pub thing works well. We are working on trying to get him to control his anger issues; we signed him up for boxing lessons to take it out on a punch bag instead of property. He is enjoying boxing. Getting him to eat is a challenge but we are working on that, too. 



I hope in the next years he can get better towards a bright future. I know this isn't really promoting conversation but I just wanna say if you can afford to adopt please do it. It can really help change  a persons life. 


Edit: wow, gold! thanks! wow again?? really made my night thank you!

Edit 2: since lot's of people want updates i will give you guys updates in the future. "
14,0,I noticed a post earlier about us being more anti-social with age; which I do completely agree with in my own personal life.  But I think it’s interesting that this is a small thing we COULD look forward to.
15,0,"Just found out and I am so happy right now!!


Obligatory edit: Jesus, front page really? I've been a redditor for a few years now and I gotta say I'm overwhelmed by your support (except for that one guy who said he wanted to have sex with my unborn child but hey, internet am I right?). Anyway thanks for the love and I'll make sure in 8/9 months to show my baby off to you guys!"
16,0,"This happens to me all the time. I want to comment, but it will just get lost since it's too late and just gets thrown to the bottom of the thread. I hate it lol

Edit: Even though were at and past the 5 hour mark, I don’t consider anyone’s comment useless! This kinda blew up lol"
17,0,"Basically I made a reddit account a couple of days ago so I'd be able to discuss the new Eminem album on r/eminem, but apparently I don't have enough karma to comment. Great, I can't even Reddit right

Edit: Didn't expect this to blow up the way that it did. Thanks everyone!"
18,0,Do y'all not like it too? It's nice and heartwarming!
